ItemNumber,Voice,Plausible/Implausible,Stimulus,OriginalSentence,EvType
196,passive,plausible,The intermediary was deprecated by the felon.,The intermediary deprecated the felon.,AAR
197,active,plausible,The valet entertained the envoy.,The valet entertained the envoy.,AAR
197,active,plausible,The envoy entertained the valet.,The valet entertained the envoy.,AAR
197,passive,plausible,The envoy was entertained by the valet.,The valet entertained the envoy.,AAR
197,passive,plausible,The valet was entertained by the envoy.,The valet entertained the envoy.,AAR
198,active,plausible,The manservant amused the emissary.,The manservant amused the emissary.,AAR
198,active,plausible,The emissary amused the manservant.,The manservant amused the emissary.,AAR
198,passive,plausible,The emissary was amused by the manservant.,The manservant amused the emissary.,AAR
198,passive,plausible,The manservant was amused by the emissary.,The manservant amused the emissary.,AAR
199,active,plausible,The acrobat pushed the stranger.,The acrobat pushed the stranger.,AAR
199,active,plausible,The stranger pushed the acrobat.,The acrobat pushed the stranger.,AAR
199,passive,plausible,The stranger was pushed by the acrobat.,The acrobat pushed the stranger.,AAR
199,passive,plausible,The acrobat was pushed by the stranger.,The acrobat pushed the stranger.,AAR
200,active,plausible,The gymnast shoved the outsider.,The gymnast shoved the outsider.,AAR
200,active,plausible,The outsider shoved the gymnast.,The gymnast shoved the outsider.,AAR
200,passive,plausible,The outsider was shoved by the gymnast.,The gymnast shoved the outsider.,AAR
200,passive,plausible,The gymnast was shoved by the outsider.,The gymnast shoved the outsider.,AAR
201,active,plausible,The benefactor calmed the architect.,The benefactor calmed the architect.,AAR
201,active,plausible,The architect calmed the benefactor.,The benefactor calmed the architect.,AAR
201,passive,plausible,The architect was calmed by the benefactor.,The benefactor calmed the architect.,AAR
201,passive,plausible,The benefactor was calmed by the architect.,The benefactor calmed the architect.,AAR
202,active,plausible,The patron soothed the draftsman.,The patron soothed the draftsman.,AAR
202,active,plausible,The draftsman soothed the patron.,The patron soothed the draftsman.,AAR
202,passive,plausible,The draftsman was soothed by the patron.,The patron soothed the draftsman.,AAR
202,passive,plausible,The patron was soothed by the draftsman.,The patron soothed the draftsman.,AAR
203,active,plausible,The therapist lauded the hairdresser.,The therapist lauded the hairdresser.,AAR
203,active,plausible,The hairdresser lauded the therapist.,The therapist lauded the hairdresser.,AAR
203,passive,plausible,The hairdresser was lauded by the therapist.,The therapist lauded the hairdresser.,AAR
203,passive,plausible,The therapist was lauded by the hairdresser.,The therapist lauded the hairdresser.,AAR
204,active,plausible,The psychologist extolled the hairstylist.,The psychologist extolled the hairstylist.,AAR
204,active,plausible,The hairstylist extolled the psychologist.,The psychologist extolled the hairstylist.,AAR
204,passive,plausible,The hairstylist was extolled by the psychologist.,The psychologist extolled the hairstylist.,AAR
204,passive,plausible,The psychologist was extolled by the hairstylist.,The psychologist extolled the hairstylist.,AAR
205,active,plausible,The nobleman married the baroness.,The nobleman married the baroness.,AAR
205,active,plausible,The baroness married the nobleman.,The nobleman married the baroness.,AAR
205,passive,plausible,The baroness was married by the nobleman.,The nobleman married the baroness.,AAR
205,passive,plausible,The nobleman was married by the baroness.,The nobleman married the baroness.,AAR
206,active,plausible,The aristocrat wed the countess.,The aristocrat wed the countess.,AAR
206,active,plausible,The countess wed the aristocrat.,The aristocrat wed the countess.,AAR
206,passive,plausible,The countess was wed by the aristocrat.,The aristocrat wed the countess.,AAR
206,passive,plausible,The aristocrat was wed by the countess.,The aristocrat wed the countess.,AAR
207,active,plausible,The actuary assuaged the creditor.,The actuary assuaged the creditor.,AAR
207,active,plausible,The creditor assuaged the actuary.,The actuary assuaged the creditor.,AAR
207,passive,plausible,The creditor was assuaged by the actuary.,The actuary assuaged the creditor.,AAR
207,passive,plausible,The actuary was assuaged by the creditor.,The actuary assuaged the creditor.,AAR
208,active,plausible,The analyst relieved the investor.,The analyst relieved the investor.,AAR
208,active,plausible,The investor relieved the analyst.,The analyst relieved the investor.,AAR
208,passive,plausible,The investor was relieved by the analyst.,The analyst relieved the investor.,AAR
208,passive,plausible,The analyst was relieved by the investor.,The analyst relieved the investor.,AAR
209,active,plausible,The sailor frightened the psychic.,The sailor frightened the psychic.,AAR
209,active,plausible,The psychic frightened the sailor.,The sailor frightened the psychic.,AAR
209,passive,plausible,The psychic was frightened by the sailor.,The sailor frightened the psychic.,AAR
209,passive,plausible,The sailor was frightened by the psychic.,The sailor frightened the psychic.,AAR
210,active,plausible,The mariner scared the fortune-teller.,The mariner scared the fortune-teller.,AAR
210,active,plausible,The fortune-teller scared the mariner.,The mariner scared the fortune-teller.,AAR
210,passive,plausible,The fortune-teller was scared by the mariner.,The mariner scared the fortune-teller.,AAR
210,passive,plausible,The mariner was scared by the fortune-teller.,The mariner scared the fortune-teller.,AAR
211,active,plausible,The assistant flattered the auditor.,The assistant flattered the auditor.,AAR
211,active,plausible,The auditor flattered the assistant.,The assistant flattered the auditor.,AAR
211,passive,plausible,The auditor was flattered by the assistant.,The assistant flattered the auditor.,AAR
211,passive,plausible,The assistant was flattered by the auditor.,The assistant flattered the auditor.,AAR
212,active,plausible,The helper complimented the appraiser.,The helper complimented the appraiser.,AAR
212,active,plausible,The appraiser complimented the helper.,The helper complimented the appraiser.,AAR
212,passive,plausible,The appraiser was complimented by the helper.,The helper complimented the appraiser.,AAR
212,passive,plausible,The helper was complimented by the appraiser.,The helper complimented the appraiser.,AAR
213,active,plausible,The immigrant believed the trooper.,The immigrant believed the trooper.,AAR
213,active,plausible,The trooper believed the immigrant.,The immigrant believed the trooper.,AAR
213,passive,plausible,The trooper was believed by the immigrant.,The immigrant believed the trooper.,AAR
213,passive,plausible,The immigrant was believed by the trooper.,The immigrant believed the trooper.,AAR
214,active,plausible,The foreigner trusted the patrolman.,The foreigner trusted the patrolman.,AAR
214,active,plausible,The patrolman trusted the foreigner.,The foreigner trusted the patrolman.,AAR
214,passive,plausible,The patrolman was trusted by the foreigner.,The foreigner trusted the patrolman.,AAR
214,passive,plausible,The foreigner was trusted by the patrolman.,The foreigner trusted the patrolman.,AAR
215,active,plausible,The mapmaker affronted the farmer.,The mapmaker affronted the farmer.,AAR
215,active,plausible,The farmer affronted the mapmaker.,The mapmaker affronted the farmer.,AAR
215,passive,plausible,The farmer was affronted by the mapmaker.,The mapmaker affronted the farmer.,AAR
215,passive,plausible,The mapmaker was affronted by the farmer.,The mapmaker affronted the farmer.,AAR
216,active,plausible,The cartographer insulted the rancher.,The cartographer insulted the rancher.,AAR
216,active,plausible,The rancher insulted the cartographer.,The cartographer insulted the rancher.,AAR
216,passive,plausible,The rancher was insulted by the cartographer.,The cartographer insulted the rancher.,AAR
216,passive,plausible,The cartographer was insulted by the rancher.,The cartographer insulted the rancher.,AAR
217,active,plausible,The poet awed the entertainer.,The poet awed the entertainer.,AAR
217,active,plausible,The entertainer awed the poet.,The poet awed the entertainer.,AAR
217,passive,plausible,The entertainer was awed by the poet.,The poet awed the entertainer.,AAR
217,passive,plausible,The poet was awed by the entertainer.,The poet awed the entertainer.,AAR
218,active,plausible,The lyricist dazzled the performer.,The lyricist dazzled the performer.,AAR
218,active,plausible,The performer dazzled the lyricist.,The lyricist dazzled the performer.,AAR
218,passive,plausible,The performer was dazzled by the lyricist.,The lyricist dazzled the performer.,AAR
218,passive,plausible,The lyricist was dazzled by the performer.,The lyricist dazzled the performer.,AAR
219,active,plausible,The peddler tested the manager.,The peddler tested the manager.,AAR
219,active,plausible,The manager tested the peddler.,The peddler tested the manager.,AAR
219,passive,plausible,The manager was tested by the peddler.,The peddler tested the manager.,AAR
219,passive,plausible,The peddler was tested by the manager.,The peddler tested the manager.,AAR
220,active,plausible,The traveling salesman challenged the executive.,The traveling salesman challenged the executive.,AAR
220,active,plausible,The executive challenged the traveling salesman.,The traveling salesman challenged the executive.,AAR
220,passive,plausible,The executive was challenged by the traveling salesman.,The traveling salesman challenged the executive.,AAR
220,passive,plausible,The traveling salesman was challenged by the executive.,The traveling salesman challenged the executive.,AAR
221,active,plausible,The musician admired the diva.,The musician admired the diva.,AAR
221,active,plausible,The diva admired the musician.,The musician admired the diva.,AAR
221,passive,plausible,The diva was admired by the musician.,The musician admired the diva.,AAR
221,passive,plausible,The musician was admired by the diva.,The musician admired the diva.,AAR
222,active,plausible,The instrumentalist adored the prima donna.,The instrumentalist adored the prima donna.,AAR
222,active,plausible,The prima donna adored the instrumentalist.,The instrumentalist adored the prima donna.,AAR
222,passive,plausible,The prima donna was adored by the instrumentalist.,The instrumentalist adored the prima donna.,AAR
222,passive,plausible,The instrumentalist was adored by the prima donna.,The instrumentalist adored the prima donna.,AAR
223,active,plausible,The general welcomed the hero.,The general welcomed the hero.,AAR
223,active,plausible,The hero welcomed the general.,The general welcomed the hero.,AAR
223,passive,plausible,The hero was welcomed by the general.,The general welcomed the hero.,AAR
223,passive,plausible,The general was welcomed by the hero.,The general welcomed the hero.,AAR
224,active,plausible,The commander greeted the champion.,The commander greeted the champion.,AAR
224,active,plausible,The champion greeted the commander.,The commander greeted the champion.,AAR
224,passive,plausible,The champion was greeted by the commander.,The commander greeted the champion.,AAR
224,passive,plausible,The commander was greeted by the champion.,The commander greeted the champion.,AAR
225,active,plausible,The cobbler disdained the stonecutter.,The cobbler disdained the stonecutter.,AAR
225,active,plausible,The stonecutter disdained the cobbler.,The cobbler disdained the stonecutter.,AAR
225,passive,plausible,The stonecutter was disdained by the cobbler.,The cobbler disdained the stonecutter.,AAR
225,passive,plausible,The cobbler was disdained by the stonecutter.,The cobbler disdained the stonecutter.,AAR
226,active,plausible,The shoemaker scorned the mason.,The shoemaker scorned the mason.,AAR
226,active,plausible,The mason scorned the shoemaker.,The shoemaker scorned the mason.,AAR
226,passive,plausible,The mason was scorned by the shoemaker.,The shoemaker scorned the mason.,AAR
226,passive,plausible,The shoemaker was scorned by the mason.,The shoemaker scorned the mason.,AAR
227,active,plausible,The postman noticed the chaplain.,The postman noticed the chaplain.,AAR
227,active,plausible,The chaplain noticed the postman.,The postman noticed the chaplain.,AAR
227,passive,plausible,The chaplain was noticed by the postman.,The postman noticed the chaplain.,AAR
227,passive,plausible,The postman was noticed by the chaplain.,The postman noticed the chaplain.,AAR
228,active,plausible,The mailman saw the minister.,The mailman saw the minister.,AAR
228,active,plausible,The minister saw the mailman.,The mailman saw the minister.,AAR
228,passive,plausible,The minister was seen by the mailman.,The mailman saw the minister.,AAR
228,passive,plausible,The mailman was seen by the minister.,The mailman saw the minister.,AAR
229,active,plausible,The composer begrudged the playwright.,The composer begrudged the playwright.,AAR
229,active,plausible,The playwright begrudged the composer.,The composer begrudged the playwright.,AAR
229,passive,plausible,The playwright was begrudged by the composer.,The composer begrudged the playwright.,AAR
229,passive,plausible,The composer was begrudged by the playwright.,The composer begrudged the playwright.,AAR
230,active,plausible,The songwriter envied the dramatist.,The songwriter envied the dramatist.,AAR
230,active,plausible,The dramatist envied the songwriter.,The songwriter envied the dramatist.,AAR
230,passive,plausible,The dramatist was envied by the songwriter.,The songwriter envied the dramatist.,AAR
230,passive,plausible,The songwriter was envied by the dramatist.,The songwriter envied the dramatist.,AAR
231,active,plausible,The dictator angered the residents.,The dictator angered the residents.,AAR
231,active,plausible,The residents angered the dictator.,The dictator angered the residents.,AAR
231,passive,plausible,The residents were angered by the dictator.,The dictator angered the residents.,AAR
231,passive,plausible,The dictator were angered by the residents.,The dictator angered the residents.,AAR
232,active,plausible,The despot enraged the townspeople.,The despot enraged the townspeople.,AAR
232,active,plausible,The townspeople enraged the despot.,The despot enraged the townspeople.,AAR
232,passive,plausible,The townspeople were enraged by the despot.,The despot enraged the townspeople.,AAR
232,passive,plausible,The despot were enraged by the townspeople.,The despot enraged the townspeople.,AAR
233,active,plausible,The missionary baffled the oracle.,The missionary baffled the oracle.,AAR
233,active,plausible,The oracle baffled the missionary.,The missionary baffled the oracle.,AAR
233,passive,plausible,The oracle was baffled by the missionary.,The missionary baffled the oracle.,AAR
233,passive,plausible,The missionary was baffled by the oracle.,The missionary baffled the oracle.,AAR
234,active,plausible,The evangelist mystified the soothsayer.,The evangelist mystified the soothsayer.,AAR
234,active,plausible,The soothsayer mystified the evangelist.,The evangelist mystified the soothsayer.,AAR
234,passive,plausible,The soothsayer was mystified by the evangelist.,The evangelist mystified the soothsayer.,AAR
234,passive,plausible,The evangelist was mystified by the soothsayer.,The evangelist mystified the soothsayer.,AAR
235,active,plausible,The trespasser choked the fighter.,The trespasser choked the fighter.,AAR
235,active,plausible,The fighter choked the trespasser.,The trespasser choked the fighter.,AAR
235,passive,plausible,The fighter was choked by the trespasser.,The trespasser choked the fighter.,AAR
235,passive,plausible,The trespasser was choked by the fighter.,The trespasser choked the fighter.,AAR
236,active,plausible,The encroacher strangled the warrior.,The encroacher strangled the warrior.,AAR
236,active,plausible,The warrior strangled the encroacher.,The encroacher strangled the warrior.,AAR
236,passive,plausible,The warrior was strangled by the encroacher.,The encroacher strangled the warrior.,AAR
236,passive,plausible,The encroacher was strangled by the warrior.,The encroacher strangled the warrior.,AAR
237,active,plausible,The broker introduced the donor.,The broker introduced the donor.,AAR
237,active,plausible,The donor introduced the broker.,The broker introduced the donor.,AAR
237,passive,plausible,The donor was introduced by the broker.,The broker introduced the donor.,AAR
237,passive,plausible,The broker was introduced by the donor.,The broker introduced the donor.,AAR
238,active,plausible,The dealer presented the sponsor.,The dealer presented the sponsor.,AAR
238,active,plausible,The sponsor presented the dealer.,The dealer presented the sponsor.,AAR
238,passive,plausible,The sponsor was presented by the dealer.,The dealer presented the sponsor.,AAR
238,passive,plausible,The dealer was presented by the sponsor.,The dealer presented the sponsor.,AAR
239,active,plausible,The shrink commended the dean.,The shrink commended the dean.,AAR
239,active,plausible,The dean commended the shrink.,The shrink commended the dean.,AAR
239,passive,plausible,The dean was commended by the shrink.,The shrink commended the dean.,AAR
239,passive,plausible,The shrink was commended by the dean.,The shrink commended the dean.,AAR
240,active,plausible,The psychiatrist applauded the provost.,The psychiatrist applauded the provost.,AAR
240,active,plausible,The provost applauded the psychiatrist.,The psychiatrist applauded the provost.,AAR
240,passive,plausible,The provost was applauded by the psychiatrist.,The psychiatrist applauded the provost.,AAR
240,passive,plausible,The psychiatrist was applauded by the provost.,The psychiatrist applauded the provost.,AAR
241,active,plausible,The refugee provoked the homeless person.,The refugee provoked the homeless person.,AAR
241,active,plausible,The homeless person provoked the refugee.,The refugee provoked the homeless person.,AAR
241,passive,plausible,The homeless person was provoked by the refugee.,The refugee provoked the homeless person.,AAR
241,passive,plausible,The refugee was provoked by the homeless person.,The refugee provoked the homeless person.,AAR
242,active,plausible,The asylum seeker goaded the vagrant.,The asylum seeker goaded the vagrant.,AAR
242,active,plausible,The vagrant goaded the asylum seeker.,The asylum seeker goaded the vagrant.,AAR
242,passive,plausible,The vagrant was goaded by the asylum seeker.,The asylum seeker goaded the vagrant.,AAR
242,passive,plausible,The asylum seeker was goaded by the vagrant.,The asylum seeker goaded the vagrant.,AAR
243,active,plausible,The interpreter swindled the messenger.,The interpreter swindled the messenger.,AAR
243,active,plausible,The messenger swindled the interpreter.,The interpreter swindled the messenger.,AAR
243,passive,plausible,The messenger was swindled by the interpreter.,The interpreter swindled the messenger.,AAR
243,passive,plausible,The interpreter was swindled by the messenger.,The interpreter swindled the messenger.,AAR
244,active,plausible,The translator deceived the courier.,The translator deceived the courier.,AAR
244,active,plausible,The courier deceived the translator.,The translator deceived the courier.,AAR
244,passive,plausible,The courier was deceived by the translator.,The translator deceived the courier.,AAR
244,passive,plausible,The translator was deceived by the courier.,The translator deceived the courier.,AAR
245,active,plausible,The gangster hated the governor.,The gangster hated the governor.,AAR
245,active,plausible,The governor hated the gangster.,The gangster hated the governor.,AAR
245,passive,plausible,The governor was hated by the gangster.,The gangster hated the governor.,AAR
245,passive,plausible,The gangster was hated by the governor.,The gangster hated the governor.,AAR
246,active,plausible,The hoodlum abhorred the chancellor.,The hoodlum abhorred the chancellor.,AAR
246,active,plausible,The chancellor abhorred the hoodlum.,The hoodlum abhorred the chancellor.,AAR
246,passive,plausible,The chancellor was abhorred by the hoodlum.,The hoodlum abhorred the chancellor.,AAR
246,passive,plausible,The hoodlum was abhorred by the chancellor.,The hoodlum abhorred the chancellor.,AAR
247,active,plausible,The planner convinced the customer.,The planner convinced the customer.,AAR
247,active,plausible,The customer convinced the planner.,The planner convinced the customer.,AAR
247,passive,plausible,The customer was convinced by the planner.,The planner convinced the customer.,AAR
247,passive,plausible,The planner was convinced by the customer.,The planner convinced the customer.,AAR
248,active,plausible,The organizer persuaded the buyer.,The organizer persuaded the buyer.,AAR
248,active,plausible,The buyer persuaded the organizer.,The organizer persuaded the buyer.,AAR
248,passive,plausible,The buyer was persuaded by the organizer.,The organizer persuaded the buyer.,AAR
248,passive,plausible,The organizer was persuaded by the buyer.,The organizer persuaded the buyer.,AAR
249,active,plausible,The wizard protected the gnome.,The wizard protected the gnome.,AAR
249,active,plausible,The gnome protected the wizard.,The wizard protected the gnome.,AAR
249,passive,plausible,The gnome was protected by the wizard.,The wizard protected the gnome.,AAR
249,passive,plausible,The wizard was protected by the gnome.,The wizard protected the gnome.,AAR
250,active,plausible,The sorcerer defended the dwarf.,The sorcerer defended the dwarf.,AAR
250,active,plausible,The dwarf defended the sorcerer.,The sorcerer defended the dwarf.,AAR
250,passive,plausible,The dwarf was defended by the sorcerer.,The sorcerer defended the dwarf.,AAR
250,passive,plausible,The sorcerer was defended by the dwarf.,The sorcerer defended the dwarf.,AAR
251,active,plausible,The runner encountered the co-worker.,The runner bumped into the co-worker.,AAR
251,active,plausible,The co-worker encountered the runner.,The runner bumped into the co-worker.,AAR
251,passive,plausible,The co-worker was encountered by the runner.,The runner bumped into the co-worker.,AAR
251,passive,plausible,The runner was encountered by the co-worker.,The runner bumped into the co-worker.,AAR
252,active,plausible,The jogger met the colleague.,The jogger ran into the colleague.,AAR
252,active,plausible,The colleague met the jogger.,The jogger ran into the colleague.,AAR
252,passive,plausible,The colleague was met by the jogger.,The jogger ran into the colleague.,AAR
252,passive,plausible,The jogger was met by the colleague.,The jogger ran into the colleague.,AAR
253,active,plausible,The student befuddled the professor.,The student befuddled the professor.,AAR
253,active,plausible,The professor befuddled the student.,The student befuddled the professor.,AAR
253,passive,plausible,The professor was befuddled by the student.,The student befuddled the professor.,AAR
253,passive,plausible,The student was befuddled by the professor.,The student befuddled the professor.,AAR
254,active,plausible,The scholar confused the lecturer.,The scholar confused the lecturer.,AAR
254,active,plausible,The lecturer confused the scholar.,The scholar confused the lecturer.,AAR
254,passive,plausible,The lecturer was confused by the scholar.,The scholar confused the lecturer.,AAR
254,passive,plausible,The scholar was confused by the lecturer.,The scholar confused the lecturer.,AAR
255,active,plausible,The invader spotted the sentry.,The invader spotted the sentry.,AAR
255,active,plausible,The sentry spotted the invader.,The invader spotted the sentry.,AAR
255,passive,plausible,The sentry was spotted by the invader.,The invader spotted the sentry.,AAR
255,passive,plausible,The invader was spotted by the sentry.,The invader spotted the sentry.,AAR
256,active,plausible,The intruder sighted the watchman.,The intruder sighted the watchman.,AAR
256,active,plausible,The watchman sighted the intruder.,The intruder sighted the watchman.,AAR
256,passive,plausible,The watchman was sighted by the intruder.,The intruder sighted the watchman.,AAR
256,passive,plausible,The intruder was sighted by the watchman.,The intruder sighted the watchman.,AAR
257,active,plausible,The supplier reimbursed the merchant.,The supplier reimbursed the merchant.,AAR
257,active,plausible,The merchant reimbursed the supplier.,The supplier reimbursed the merchant.,AAR
257,passive,plausible,The merchant was reimbursed by the supplier.,The supplier reimbursed the merchant.,AAR
257,passive,plausible,The supplier was reimbursed by the merchant.,The supplier reimbursed the merchant.,AAR
258,active,plausible,The wholesaler compensated the trader.,The wholesaler compensated the trader.,AAR
258,active,plausible,The trader compensated the wholesaler.,The wholesaler compensated the trader.,AAR
258,passive,plausible,The trader was compensated by the wholesaler.,The wholesaler compensated the trader.,AAR
258,passive,plausible,The wholesaler was compensated by the trader.,The wholesaler compensated the trader.,AAR
259,active,plausible,The accuser confronted the vandal.,The accuser confronted the vandal.,AAR
259,active,plausible,The vandal confronted the accuser.,The accuser confronted the vandal.,AAR
259,passive,plausible,The vandal was confronted by the accuser.,The accuser confronted the vandal.,AAR
259,passive,plausible,The accuser was confronted by the vandal.,The accuser confronted the vandal.,AAR
260,active,plausible,The plaintiff accosted the thug.,The plaintiff accosted the thug.,AAR
