ItemNumber,Voice,Plausible/Implausible,Stimulus,OriginalSentence,EvType
134,active,plausible,The lawyer questioned the witness.,The lawyer questioned the witness.,AAN
134,active,implausible,The witness questioned the lawyer.,The lawyer questioned the witness.,AAN
134,passive,plausible,The witness was questioned by the lawyer.,The lawyer questioned the witness.,AAN
134,passive,implausible,The lawyer was questioned by the witness.,The lawyer questioned the witness.,AAN
135,active,plausible,The attorney interrogated the bystander.,The attorney interrogated the bystander.,AAN
135,active,implausible,The bystander interrogated the attorney.,The attorney interrogated the bystander.,AAN
135,passive,plausible,The bystander was interrogated by the attorney.,The attorney interrogated the bystander.,AAN
135,passive,implausible,The attorney was interrogated by the bystander.,The attorney interrogated the bystander.,AAN
136,active,plausible,The singer disappointed the enthusiast.,The singer disappointed the enthusiast.,AAN
136,active,implausible,The enthusiast disappointed the singer.,The singer disappointed the enthusiast.,AAN
136,passive,plausible,The enthusiast was disappointed by the singer.,The singer disappointed the enthusiast.,AAN
136,passive,implausible,The singer was disappointed by the enthusiast.,The singer disappointed the enthusiast.,AAN
137,active,plausible,The vocalist disillusioned the connoisseur.,The vocalist disillusioned the connoisseur.,AAN
137,active,implausible,The connoisseur disillusioned the vocalist.,The vocalist disillusioned the connoisseur.,AAN
137,passive,plausible,The connoisseur was disillusioned by the vocalist.,The vocalist disillusioned the connoisseur.,AAN
137,passive,implausible,The vocalist was disillusioned by the connoisseur.,The vocalist disillusioned the connoisseur.,AAN
138,active,plausible,The chauffeur drove the diplomat.,The chauffeur drove the diplomat.,AAN
138,active,implausible,The diplomat drove the chauffeur.,The chauffeur drove the diplomat.,AAN
138,passive,plausible,The diplomat was driven by the chauffeur.,The chauffeur drove the diplomat.,AAN
138,passive,implausible,The chauffeur was driven by the diplomat.,The chauffeur drove the diplomat.,AAN
139,active,plausible,The driver transported the ambassador.,The driver transported the ambassador.,AAN
139,active,implausible,The ambassador transported the driver.,The driver transported the ambassador.,AAN
139,passive,plausible,The ambassador was transported by the driver.,The driver transported the ambassador.,AAN
139,passive,implausible,The driver was transported by the ambassador.,The driver transported the ambassador.,AAN
140,active,plausible,The guard apprehended the prisoner.,The guard apprehended the prisoner.,AAN
140,active,implausible,The prisoner apprehended the guard.,The guard apprehended the prisoner.,AAN
140,passive,plausible,The prisoner was apprehended by the guard.,The guard apprehended the prisoner.,AAN
140,passive,implausible,The guard was apprehended by the prisoner.,The guard apprehended the prisoner.,AAN
141,active,plausible,The warden caught the inmate.,The warden caught the inmate.,AAN
141,active,implausible,The inmate caught the warden.,The warden caught the inmate.,AAN
141,passive,plausible,The inmate was caught by the warden.,The warden caught the inmate.,AAN
141,passive,implausible,The warden was caught by the inmate.,The warden caught the inmate.,AAN
142,active,plausible,The tailor costumed the dancer.,The tailor costumed the dancer.,AAN
142,active,implausible,The dancer costumed the tailor.,The tailor costumed the dancer.,AAN
142,passive,plausible,The dancer was costumed by the tailor.,The tailor costumed the dancer.,AAN
142,passive,implausible,The tailor was costumed by the dancer.,The tailor costumed the dancer.,AAN
143,active,plausible,The dressmaker attired the ballerina.,The dressmaker attired the ballerina.,AAN
143,active,implausible,The ballerina attired the dressmaker.,The dressmaker attired the ballerina.,AAN
143,passive,plausible,The ballerina was attired by the dressmaker.,The dressmaker attired the ballerina.,AAN
143,passive,implausible,The dressmaker was attired by the ballerina.,The dressmaker attired the ballerina.,AAN
144,active,plausible,The principal scolded the child.,The principal scolded the child.,AAN
144,active,implausible,The child scolded the principal.,The principal scolded the child.,AAN
144,passive,plausible,The child was scolded by the principal.,The principal scolded the child.,AAN
144,passive,implausible,The principal was scolded by the child.,The principal scolded the child.,AAN
145,active,plausible,The headmaster reprimanded the kid.,The headmaster reprimanded the kid.,AAN
145,active,implausible,The kid reprimanded the headmaster.,The headmaster reprimanded the kid.,AAN
145,passive,plausible,The kid was reprimanded by the headmaster.,The headmaster reprimanded the kid.,AAN
145,passive,implausible,The headmaster was reprimanded by the kid.,The headmaster reprimanded the kid.,AAN
146,active,plausible,The lord named the heir.,The lord named the heir.,AAN
146,active,implausible,The heir named the lord.,The lord named the heir.,AAN
146,passive,plausible,The heir was named by the lord.,The lord named the heir.,AAN
146,passive,implausible,The lord was named by the heir.,The lord named the heir.,AAN
147,active,plausible,The baron chose the successor.,The baron chose the successor.,AAN
147,active,implausible,The successor chose the baron.,The baron chose the successor.,AAN
147,passive,plausible,The successor was chosen by the baron.,The baron chose the successor.,AAN
147,passive,implausible,The baron was chosen by the successor.,The baron chose the successor.,AAN
148,active,plausible,The cop restrained the rioter.,The cop restrained the rioter.,AAN
148,active,implausible,The rioter restrained the cop.,The cop restrained the rioter.,AAN
148,passive,plausible,The rioter was restrained by the cop.,The cop restrained the rioter.,AAN
148,passive,implausible,The cop was restrained by the rioter.,The cop restrained the rioter.,AAN
149,active,plausible,The policeman subdued the rabble-rouser.,The policeman subdued the rabble-rouser.,AAN
149,active,implausible,The rabble-rouser subdued the policeman.,The policeman subdued the rabble-rouser.,AAN
149,passive,plausible,The rabble-rouser was subdued by the policeman.,The policeman subdued the rabble-rouser.,AAN
149,passive,implausible,The policeman was subdued by the rabble-rouser.,The policeman subdued the rabble-rouser.,AAN
150,active,plausible,The dad coddled the baby.,The dad coddled the baby.,AAN
150,active,implausible,The baby coddled the dad.,The dad coddled the baby.,AAN
150,passive,plausible,The baby was coddled by the dad.,The dad coddled the baby.,AAN
150,passive,implausible,The dad was coddled by the baby.,The dad coddled the baby.,AAN
151,active,plausible,The father pampered the infant.,The father pampered the infant.,AAN
151,active,implausible,The infant pampered the father.,The father pampered the infant.,AAN
151,passive,plausible,The infant was pampered by the father.,The father pampered the infant.,AAN
151,passive,implausible,The father was pampered by the infant.,The father pampered the infant.,AAN
152,active,plausible,The king exiled the rebel.,The king exiled the rebel.,AAN
152,active,implausible,The rebel exiled the king.,The king exiled the rebel.,AAN
152,passive,plausible,The rebel was exiled by the king.,The king exiled the rebel.,AAN
152,passive,implausible,The king was exiled by the rebel.,The king exiled the rebel.,AAN
153,active,plausible,The monarch banished the insurgent.,The monarch banished the insurgent.,AAN
153,active,implausible,The insurgent banished the monarch.,The monarch banished the insurgent.,AAN
153,passive,plausible,The insurgent was banished by the monarch.,The monarch banished the insurgent.,AAN
153,passive,implausible,The monarch was banished by the insurgent.,The monarch banished the insurgent.,AAN
154,active,plausible,The thief robbed the manufacturer.,The thief robbed the manufacturer.,AAN
154,active,implausible,The manufacturer robbed the thief.,The thief robbed the manufacturer.,AAN
154,passive,plausible,The manufacturer was robbed by the thief.,The thief robbed the manufacturer.,AAN
154,passive,implausible,The thief was robbed by the manufacturer.,The thief robbed the manufacturer.,AAN
155,active,plausible,The robber burgled the industrialist.,The robber burgled the industrialist.,AAN
155,active,implausible,The industrialist burgled the robber.,The robber burgled the industrialist.,AAN
155,passive,plausible,The industrialist was burgled by the robber.,The robber burgled the industrialist.,AAN
155,passive,implausible,The robber was burgled by the industrialist.,The robber burgled the industrialist.,AAN
156,active,plausible,The pessimist discouraged the contestant.,The pessimist discouraged the contestant.,AAN
156,active,implausible,The contestant discouraged the pessimist.,The pessimist discouraged the contestant.,AAN
156,passive,plausible,The contestant was discouraged by the pessimist.,The pessimist discouraged the contestant.,AAN
156,passive,implausible,The pessimist was discouraged by the contestant.,The pessimist discouraged the contestant.,AAN
157,active,plausible,The cynic dissuaded the participant.,The cynic dissuaded the participant.,AAN
157,active,implausible,The participant dissuaded the cynic.,The cynic dissuaded the participant.,AAN
157,passive,plausible,The participant was dissuaded by the cynic.,The cynic dissuaded the participant.,AAN
157,passive,implausible,The cynic was dissuaded by the participant.,The cynic dissuaded the participant.,AAN
158,active,plausible,The loudmouth tormented the loner.,The loudmouth tormented the loner.,AAN
158,active,implausible,The loner tormented the loudmouth.,The loudmouth tormented the loner.,AAN
158,passive,plausible,The loner was tormented by the loudmouth.,The loudmouth tormented the loner.,AAN
158,passive,implausible,The loudmouth was tormented by the loner.,The loudmouth tormented the loner.,AAN
159,active,plausible,The windbag taunted the recluse.,The windbag taunted the recluse.,AAN
159,active,implausible,The recluse taunted the windbag.,The windbag taunted the recluse.,AAN
159,passive,plausible,The recluse was taunted by the windbag.,The windbag taunted the recluse.,AAN
159,passive,implausible,The windbag was taunted by the recluse.,The windbag taunted the recluse.,AAN
160,active,plausible,The imitator fooled the investigator.,The imitator fooled the investigator.,AAN
160,active,implausible,The investigator fooled the imitator.,The imitator fooled the investigator.,AAN
160,passive,plausible,The investigator was fooled by the imitator.,The imitator fooled the investigator.,AAN
160,passive,implausible,The imitator was fooled by the investigator.,The imitator fooled the investigator.,AAN
161,active,plausible,The impersonator conned the inspector.,The impersonator conned the inspector.,AAN
161,active,implausible,The inspector conned the impersonator.,The impersonator conned the inspector.,AAN
161,passive,plausible,The inspector was conned by the impersonator.,The impersonator conned the inspector.,AAN
161,passive,implausible,The impersonator was conned by the inspector.,The impersonator conned the inspector.,AAN
162,active,plausible,The boss fired the worker.,The boss fired the worker.,AAN
162,active,implausible,The worker fired the boss.,The boss fired the worker.,AAN
162,passive,plausible,The worker was fired by the boss.,The boss fired the worker.,AAN
162,passive,implausible,The boss was fired by the worker.,The boss fired the worker.,AAN
163,active,plausible,The pyromaniac unnerved the shopkeeper.,The pyromaniac unnerved the shopkeeper.,AAN
163,active,implausible,The shopkeeper unnerved the pyromaniac.,The pyromaniac unnerved the shopkeeper.,AAN
163,passive,plausible,The shopkeeper was unnerved by the pyromaniac.,The pyromaniac unnerved the shopkeeper.,AAN
163,passive,implausible,The pyromaniac was unnerved by the shopkeeper.,The pyromaniac unnerved the shopkeeper.,AAN
164,active,plausible,The arsonist alarmed the vendor.,The arsonist alarmed the vendor.,AAN
164,active,implausible,The vendor alarmed the arsonist.,The arsonist alarmed the vendor.,AAN
164,passive,plausible,The vendor was alarmed by the arsonist.,The arsonist alarmed the vendor.,AAN
164,passive,implausible,The arsonist was alarmed by the vendor.,The arsonist alarmed the vendor.,AAN
165,active,plausible,The professional supported the beginner.,The professional supported the beginner.,AAN
165,active,implausible,The beginner supported the professional.,The professional supported the beginner.,AAN
165,passive,plausible,The beginner was supported by the professional.,The professional supported the beginner.,AAN
165,passive,implausible,The professional was supported by the beginner.,The professional supported the beginner.,AAN
166,active,plausible,The master encouraged the rookie.,The master encouraged the rookie.,AAN
166,active,implausible,The rookie encouraged the master.,The master encouraged the rookie.,AAN
166,passive,plausible,The rookie was encouraged by the master.,The master encouraged the rookie.,AAN
166,passive,implausible,The master was encouraged by the rookie.,The master encouraged the rookie.,AAN
167,active,plausible,The magician hypnotized the crowd.,The magician hypnotized the crowd.,AAN
167,active,implausible,The crowd hypnotized the magician.,The magician hypnotized the crowd.,AAN
167,passive,plausible,The crowd was hypnotized by the magician.,The magician hypnotized the crowd.,AAN
167,passive,implausible,The magician was hypnotized by the crowd.,The magician hypnotized the crowd.,AAN
168,active,plausible,The illusionist entranced the viewers.,The illusionist entranced the viewers.,AAN
168,active,implausible,The viewers entranced the illusionist.,The illusionist entranced the viewers.,AAN
168,passive,plausible,The viewers were entranced by the illusionist.,The illusionist entranced the viewers.,AAN
168,passive,implausible,The illusionist were entranced by the viewers.,The illusionist entranced the viewers.,AAN
169,active,plausible,The businessman employed the expert.,The businessman employed the expert.,AAN
169,active,implausible,The expert employed the businessman.,The businessman employed the expert.,AAN
169,passive,plausible,The expert was employed by the businessman.,The businessman employed the expert.,AAN
169,passive,implausible,The businessman was employed by the expert.,The businessman employed the expert.,AAN
170,active,plausible,The entrepreneur hired the specialist.,The entrepreneur hired the specialist.,AAN
170,active,implausible,The specialist hired the entrepreneur.,The entrepreneur hired the specialist.,AAN
170,passive,plausible,The specialist was hired by the entrepreneur.,The entrepreneur hired the specialist.,AAN
170,passive,implausible,The entrepreneur was hired by the specialist.,The entrepreneur hired the specialist.,AAN
171,active,plausible,The terrorist petrified the first lady.,The terrorist petrified the first lady.,AAN
171,active,implausible,The first lady petrified the terrorist.,The terrorist petrified the first lady.,AAN
171,passive,plausible,The first lady was petrified by the terrorist.,The terrorist petrified the first lady.,AAN
171,passive,implausible,The terrorist was petrified by the first lady.,The terrorist petrified the first lady.,AAN
172,active,plausible,The hijacker terrified the president's wife.,The hijacker terrified the president's wife.,AAN
172,active,implausible,The president's wife terrified the hijacker.,The hijacker terrified the president's wife.,AAN
172,passive,plausible,The president's wife was terrified by the hijacker.,The hijacker terrified the president's wife.,AAN
172,passive,implausible,The hijacker was terrified by the president's wife.,The hijacker terrified the president's wife.,AAN
173,active,plausible,The judge praised the gold medalist.,The judge praised the gold medalist.,AAN
173,active,implausible,The gold medalist praised the judge.,The judge praised the gold medalist.,AAN
173,passive,plausible,The gold medalist was praised by the judge.,The judge praised the gold medalist.,AAN
173,passive,implausible,The judge was praised by the gold medalist.,The judge praised the gold medalist.,AAN
174,active,plausible,The panelist congratulated the winner.,The panelist congratulated the winner.,AAN
174,active,implausible,The winner congratulated the panelist.,The panelist congratulated the winner.,AAN
174,passive,plausible,The winner was congratulated by the panelist.,The panelist congratulated the winner.,AAN
174,passive,implausible,The panelist was congratulated by the winner.,The panelist congratulated the winner.,AAN
175,active,plausible,The liar emulated the victor.,The liar emulated the victor.,AAN
175,active,implausible,The victor emulated the liar.,The liar emulated the victor.,AAN
175,passive,plausible,The victor was emulated by the liar.,The liar emulated the victor.,AAN
175,passive,implausible,The liar was emulated by the victor.,The liar emulated the victor.,AAN
176,active,plausible,The deceiver imitated the conqueror.,The deceiver imitated the conqueror.,AAN
176,active,implausible,The conqueror imitated the deceiver.,The deceiver imitated the conqueror.,AAN
176,passive,plausible,The conqueror was imitated by the deceiver.,The deceiver imitated the conqueror.,AAN
176,passive,implausible,The deceiver was imitated by the conqueror.,The deceiver imitated the conqueror.,AAN
177,active,plausible,The environmentalist cautioned the tobacconist.,The environmentalist cautioned the tobacconist.,AAN
177,active,implausible,The tobacconist cautioned the environmentalist.,The environmentalist cautioned the tobacconist.,AAN
177,passive,plausible,The tobacconist was cautioned by the environmentalist.,The environmentalist cautioned the tobacconist.,AAN
177,passive,implausible,The environmentalist was cautioned by the tobacconist.,The environmentalist cautioned the tobacconist.,AAN
178,active,plausible,The ecologist warned the cigar-maker.,The ecologist warned the cigar-maker.,AAN
178,active,implausible,The cigar-maker warned the ecologist.,The ecologist warned the cigar-maker.,AAN
178,passive,plausible,The cigar-maker was warned by the ecologist.,The ecologist warned the cigar-maker.,AAN
178,passive,implausible,The ecologist was warned by the cigar-maker.,The ecologist warned the cigar-maker.,AAN
179,active,plausible,The peasant idolized the ancestors.,The peasant idolized his ancestors.,AAN
179,active,implausible,The ancestors idolized the peasant.,The peasant idolized his ancestors.,AAN
179,passive,plausible,The ancestors were idolized by the peasant.,The peasant idolized his ancestors.,AAN
179,passive,implausible,The peasant were idolized by the ancestors.,The peasant idolized his ancestors.,AAN
180,active,plausible,The serf worshipped the forefathers.,The serf worshipped his forefathers.,AAN
180,active,implausible,The forefathers worshipped the serf.,The serf worshipped his forefathers.,AAN
180,passive,plausible,The forefathers were worshipped by the serf.,The serf worshipped his forefathers.,AAN
180,passive,implausible,The serf were worshipped by the forefathers.,The serf worshipped his forefathers.,AAN
181,active,plausible,The alcoholic hassled the guest.,The alcoholic hassled the guest.,AAN
181,active,implausible,The guest hassled the alcoholic.,The alcoholic hassled the guest.,AAN
181,passive,plausible,The guest was hassled by the alcoholic.,The alcoholic hassled the guest.,AAN
181,passive,implausible,The alcoholic was hassled by the guest.,The alcoholic hassled the guest.,AAN
182,active,plausible,The drunk bothered the visitor.,The drunk bothered the visitor.,AAN
182,active,implausible,The visitor bothered the drunk.,The drunk bothered the visitor.,AAN
182,passive,plausible,The visitor was bothered by the drunk.,The drunk bothered the visitor.,AAN
182,passive,implausible,The drunk was bothered by the visitor.,The drunk bothered the visitor.,AAN
183,active,plausible,The commentator vexed the athlete.,The commentator vexed the athlete.,AAR
183,active,plausible,The athlete vexed the commentator.,The commentator vexed the athlete.,AAR
183,passive,plausible,The athlete was vexed by the commentator.,The commentator vexed the athlete.,AAR
183,passive,plausible,The commentator was vexed by the athlete.,The commentator vexed the athlete.,AAR
184,active,plausible,The sportscaster peeved the jock.,The sportscaster peeved the jock.,AAR
184,active,plausible,The jock peeved the sportscaster.,The sportscaster peeved the jock.,AAR
184,passive,plausible,The jock was peeved by the sportscaster.,The sportscaster peeved the jock.,AAR
184,passive,plausible,The sportscaster was peeved by the jock.,The sportscaster peeved the jock.,AAR
185,active,plausible,The preacher hugged the churchgoer.,The preacher hugged the churchgoer.,AAR
185,active,plausible,The churchgoer hugged the preacher.,The preacher hugged the churchgoer.,AAR
185,passive,plausible,The churchgoer was hugged by the preacher.,The preacher hugged the churchgoer.,AAR
185,passive,plausible,The preacher was hugged by the churchgoer.,The preacher hugged the churchgoer.,AAR
186,active,plausible,The pastor embraced the parishioner.,The pastor embraced the parishioner.,AAR
186,active,plausible,The parishioner embraced the pastor.,The pastor embraced the parishioner.,AAR
186,passive,plausible,The parishioner was embraced by the pastor.,The pastor embraced the parishioner.,AAR
186,passive,plausible,The pastor was embraced by the parishioner.,The pastor embraced the parishioner.,AAR
187,active,plausible,The maniac mocked the clown.,The maniac mocked the clown.,AAR
187,active,plausible,The clown mocked the maniac.,The maniac mocked the clown.,AAR
187,passive,plausible,The clown was mocked by the maniac.,The maniac mocked the clown.,AAR
187,passive,plausible,The maniac was mocked by the clown.,The maniac mocked the clown.,AAR
188,active,plausible,The lunatic ridiculed the jester.,The lunatic ridiculed the jester.,AAR
188,active,plausible,The jester ridiculed the lunatic.,The lunatic ridiculed the jester.,AAR
188,passive,plausible,The jester was ridiculed by the lunatic.,The lunatic ridiculed the jester.,AAR
188,passive,plausible,The lunatic was ridiculed by the jester.,The lunatic ridiculed the jester.,AAR
189,active,plausible,The archivist contacted the inventor.,The archivist contacted the inventor.,AAR
189,active,plausible,The inventor contacted the archivist.,The archivist contacted the inventor.,AAR
189,passive,plausible,The inventor was contacted by the archivist.,The archivist contacted the inventor.,AAR
189,passive,plausible,The archivist was contacted by the inventor.,The archivist contacted the inventor.,AAR
190,active,plausible,The historian approached the innovator.,The historian approached the innovator.,AAR
190,active,plausible,The innovator approached the historian.,The historian approached the innovator.,AAR
190,passive,plausible,The innovator was approached by the historian.,The historian approached the innovator.,AAR
190,passive,plausible,The historian was approached by the innovator.,The historian approached the innovator.,AAR
191,active,plausible,The janitor called the landscaper.,The janitor called the landscaper.,AAR
191,active,plausible,The landscaper called the janitor.,The janitor called the landscaper.,AAR
191,passive,plausible,The landscaper was called by the janitor.,The janitor called the landscaper.,AAR
191,passive,plausible,The janitor was called by the landscaper.,The janitor called the landscaper.,AAR
192,active,plausible,The custodian phoned the gardener.,The custodian phoned the gardener.,AAR
192,active,plausible,The gardener phoned the custodian.,The custodian phoned the gardener.,AAR
192,passive,plausible,The gardener was phoned by the custodian.,The custodian phoned the gardener.,AAR
192,passive,plausible,The custodian was phoned by the gardener.,The custodian phoned the gardener.,AAR
193,active,plausible,The drummer annoyed the weatherman.,The drummer annoyed the weatherman.,AAR
193,active,plausible,The weatherman annoyed the drummer.,The drummer annoyed the weatherman.,AAR
193,passive,plausible,The weatherman was annoyed by the drummer.,The drummer annoyed the weatherman.,AAR
193,passive,plausible,The drummer was annoyed by the weatherman.,The drummer annoyed the weatherman.,AAR
194,active,plausible,The percussionist displeased the meteorologist.,The percussionist displeased the meteorologist.,AAR
194,active,plausible,The meteorologist displeased the percussionist.,The percussionist displeased the meteorologist.,AAR
194,passive,plausible,The meteorologist was displeased by the percussionist.,The percussionist displeased the meteorologist.,AAR
194,passive,plausible,The percussionist was displeased by the meteorologist.,The percussionist displeased the meteorologist.,AAR
195,active,plausible,The go-between belittled the defendant.,The go-between belittled the defendant.,AAR
195,active,plausible,The defendant belittled the go-between.,The go-between belittled the defendant.,AAR
195,passive,plausible,The defendant was belittled by the go-between.,The go-between belittled the defendant.,AAR
195,passive,plausible,The go-between was belittled by the defendant.,The go-between belittled the defendant.,AAR
196,active,plausible,The intermediary deprecated the felon.,The intermediary deprecated the felon.,AAR
196,active,plausible,The felon deprecated the intermediary.,The intermediary deprecated the felon.,AAR
196,passive,plausible,The felon was deprecated by the intermediary.,The intermediary deprecated the felon.,AAR
